{
  "date": "2026-10-12",
  "batch": 2,
  "items": [
    {
      "id": "7d4e278f0b74844571bb3cf87efa87ac5316d15f",
      "scores": {
        "importance": 2,
        "trend": 1,
        "novelty": 2,
        "credibility": 5
      },
      "category": "Business",
      "tags": [
        "apple",
        "smart-home",
        "hardware"
      ],
      "summary": "TechCrunch piece asking whether Apple's rumored HomeView device can succeed as its first smart home product.",
      "whyItMatters": "Mostly product speculation; watch for AI assistant features.",
      "organization": "apple"
    },
    {
      "id": "48092d1d873f6f9c42aa9c42dc05a08e7b872729",
      "scores": {
        "importance": 3,
        "trend": 1,
        "novelty": 2,
        "credibility": 5
      },
      "category": "Policy & Safety",
      "tags": [
        "policy",
        "naming",
        "industry"
      ],
      "summary": "The Verge on tech companies going along with an administration push to rename AI.",
      "whyItMatters": "Signals how terminology is shifting in US policy talk.",
      "organization": "us-administration"
    },
    {
      "id": "df97c62cc773ca8681dae7e4956554b91d53bcca",
      "scores": {
        "importance": 3,
        "trend": 0,
        "novelty": 3,
        "credibility": 5
      },
      "category": "Business",
      "tags": [
        "data-centers",
        "nda",
        "community"
      ],
      "summary": "TechCrunch asks whether ending NDAs could win over opponents of data center projects.",
      "whyItMatters": "Local opposition affects where compute capacity gets built.",
      "organization": "ai-industry"
    },
    {
      "id": "778ab122b6ef9260b6e465550fb532d73d5724a8",
      "scores": {
        "importance": 3,
        "trend": 0,
        "novelty": 2,
        "credibility": 5
      },
      "category": "Business",
      "tags": [
        "voice-ai",
        "industry"
      ],
      "summary": "TechCrunch interviews executives who think voice AI has not yet had its breakout moment.",
      "whyItMatters": "Gives a sense of where voice product bets are heading.",
      "organization": "voice-ai-industry"
    },
    {
      "id": "ee92128ac4624f395088f69c897a80bf4769e6ce",
      "scores": {
        "importance": 4,
        "trend": 0,
        "novelty": 5,
        "credibility": 5
      },
      "category": "Tutorials",
      "tags": [
        "openai",
        "api",
        "tutorial"
      ],
      "summary": "Towards Data Science guide to OpenAI's new Decisions API, as the title describes.",
      "whyItMatters": "A hands-on starting point if you plan to try this API.",
      "organization": "openai"
    },
    {
      "id": "738bfae7f3b8a61f71cd81cb689774b0f4082f94",
      "scores": {
        "importance": 3,
        "trend": 1,
        "novelty": 2,
        "credibility": 4
      },
      "category": "News",
      "tags": [
        "newsletter",
        "agents",
        "claude",
        "openai"
      ],
      "summary": "The Signal newsletter issue covering an agent product, Claude documentation changes and an OpenAI item, per its headline.",
      "whyItMatters": "A quick scan of the week's lab news, though secondhand.",
      "organization": "multiple"
    },
    {
      "id": "31276c3a3106709ff201b1dae1afa5f80494fdac",
      "scores": {
        "importance": 4,
        "trend": 0,
        "novelty": 3,
        "credibility": 5
      },
      "category": "Tutorials",
      "tags": [
        "agents",
        "architecture",
        "patterns"
      ],
      "summary": "Towards Data Science guide to six advanced architectural patterns for agentic systems.",
      "whyItMatters": "Handy checklist when designing a multi-step agent.",
      "organization": "independent-authors"
    },
    {
      "id": "0b1518dc9b60572e714097df4b5561081239201f",
      "scores": {
        "importance": 2,
        "trend": 0,
        "novelty": 2,
        "credibility": 5
      },
      "category": "News",
      "tags": [
        "google",
        "ai-playground",
        "games"
      ],
      "summary": "WIRED reporter tries making games with Google's AI Playground and finds the results rough.",
      "whyItMatters": "Gives a hands-on feel for the tool's current limits.",
      "organization": "google"
    },
    {
      "id": "f379902df709de45f86c62279dbd81718e4fd7d8",
      "scores": {
        "importance": 3,
        "trend": 0,
        "novelty": 2,
        "credibility": 5
      },
      "category": "News",
      "tags": [
        "local-ai",
        "open-weights",
        "experience"
      ],
      "summary": "The Verge writer recounts learning to run AI models locally, both exciting and frustrating.",
      "whyItMatters": "Realistic expectations for getting started with local models.",
      "organization": "the-verge"
    }
  ],
  "skipped": [
    {
      "id": "8d1b5970f0e4c138f22740a6fb37cfd78cddfe2e",
      "reason": "event promotion"
    },
    {
      "id": "e179bee0d893481bcfc17c48c80fb335dd055c05",
      "reason": "not AI news"
    },
    {
      "id": "24d721d473226f250d79781b08605fb05b8f9291",
      "reason": "not AI news"
    }
  ],
  "clusterLabels": [],
  "fetches": []
}